{
  "schema": "minimal_kernel.runtime_session_witness_inspect_compare/v0",
  "kind": "minimal_kernel.runtime_session_witness_inspect_compare",
  "generated_at": "2026-05-05T00:00:00Z",
  "result": "ok",
  "artifact_context": {
    "summary_path": "cmake-build-minimal-kernel-runtime-session-witness-inspect-compare-sample/candidate/summary.json",
    "baseline_summary_path": "cmake-build-minimal-kernel-runtime-session-witness-inspect-compare-sample/baseline/summary.json",
    "compare_summary_path": "cmake-build-minimal-kernel-runtime-session-witness-inspect-compare-sample/compare/session-witness.inspect.compare.summary.json",
    "output_root": "cmake-build-minimal-kernel-runtime-session-witness-inspect-compare-sample/compare"
  },
  "current": {
    "summary_path": "cmake-build-minimal-kernel-runtime-session-witness-inspect-compare-sample/candidate/summary.json",
    "result": "fail",
    "output_root": "cmake-build-minimal-kernel-runtime-session-witness-inspect-compare-sample/candidate",
    "session": {
      "session_id": "minimal_kernel_runtime.armv7a_qemu.debug",
      "world": "minimal_kernel_runtime",
      "session_status": "collapsed",
      "failure_domain": "runtime",
      "failure_count": 1,
      "ledger_event_count": 12,
      "runtime": {
        "tick": true,
        "trap": true,
        "thread": true,
        "task_syscall": false,
        "handoff_continuity": false
      }
    },
    "world_compare_session_drift": {
      "result": "ok",
      "world_verdict": "drifted",
      "regression_count": 2,
      "required_regression_count": 1,
      "session_drift": {
        "changed": true,
        "regressed_sessions": [
          "kernel_runtime_session_sample"
        ],
        "required_regressed_sessions": [
          "kernel_runtime_session_sample"
        ],
        "affected_domains": [
          "session",
          "runtime"
        ],
        "affected_focus": [
          "session",
          "runtime",
          "handoff",
          "continuity",
          "timer"
        ],
        "missing_runtime_facts": [
          "handoff",
          "task_syscall"
        ],
        "failure_codes": [
          "handoff_continuity_broken",
          "tick_not_observed"
        ],
        "narratives": [
          "session witness `kernel_runtime_session_sample` regressed `ok` -> `fail`"
        ]
      }
    },
    "witness_session_failure_export": {
      "result": "ok",
      "world_verdict": "collapsed",
      "regression_count": 1,
      "required_regression_count": 1,
      "candidate_session_status": "collapsed",
      "session_drift": {
        "changed": true,
        "regressed_sessions": [
          "kernel_runtime_session"
        ],
        "required_regressed_sessions": [
          "kernel_runtime_session"
        ],
        "affected_domains": [
          "session",
          "runtime"
        ],
        "affected_focus": [
          "session",
          "runtime",
          "handoff",
          "continuity",
          "scheduler"
        ],
        "missing_runtime_facts": [
          "handoff",
          "task_syscall"
        ],
        "failure_codes": [
          "handoff_continuity_broken",
          "thread_not_resumed"
        ],
        "narratives": [
          "session witness `kernel_runtime_session` regressed `ok` -> `fail`"
        ]
      }
    },
    "violations": [
      "synthetic inspect compare drift",
      "session runtime regressed"
    ],
    "artifacts": {
      "summary": "cmake-build-minimal-kernel-runtime-session-witness-inspect-compare-sample/candidate/summary.json",
      "report_markdown": "cmake-build-minimal-kernel-runtime-session-witness-inspect-compare-sample/candidate/report.md",
      "check_text": "cmake-build-minimal-kernel-runtime-session-witness-inspect-compare-sample/candidate/check.txt",
      "session": {
        "output_root": "cmake-build-minimal-kernel-runtime-session-witness-inspect-compare-sample/candidate/session",
        "summary": "cmake-build-minimal-kernel-runtime-session-witness-inspect-compare-sample/candidate/session/kernel_runtime_session.summary.json",
        "runtime_ledger": "cmake-build-minimal-kernel-runtime-session-witness-inspect-compare-sample/candidate/session/runtime_ledger.json",
        "report_markdown": "cmake-build-minimal-kernel-runtime-session-witness-inspect-compare-sample/candidate/session/report.md",
        "check_text": "cmake-build-minimal-kernel-runtime-session-witness-inspect-compare-sample/candidate/session/check.txt"
      },
      "world_compare_session_drift": {
        "output_root": "cmake-build-minimal-kernel-runtime-session-witness-inspect-compare-sample/candidate/world_compare_session_drift",
        "summary": "cmake-build-minimal-kernel-runtime-session-witness-inspect-compare-sample/candidate/world_compare_session_drift/summary.json",
        "report_markdown": "cmake-build-minimal-kernel-runtime-session-witness-inspect-compare-sample/candidate/world_compare_session_drift/report.md",
        "check_text": "cmake-build-minimal-kernel-runtime-session-witness-inspect-compare-sample/candidate/world_compare_session_drift/check.txt"
      },
      "witness_session_failure_export": {
        "output_root": "cmake-build-minimal-kernel-runtime-session-witness-inspect-compare-sample/candidate/witness_session_failure_export",
        "baseline_summary": "cmake-build-minimal-kernel-runtime-session-witness-inspect-compare-sample/candidate/witness_session_failure_export/baseline/summary.json",
        "candidate_summary": "cmake-build-minimal-kernel-runtime-session-witness-inspect-compare-sample/candidate/witness_session_failure_export/candidate/summary.json",
        "world_compare_summary": "cmake-build-minimal-kernel-runtime-session-witness-inspect-compare-sample/candidate/witness_session_failure_export/world_compare/summary.json",
        "world_compare_report_markdown": "cmake-build-minimal-kernel-runtime-session-witness-inspect-compare-sample/candidate/witness_session_failure_export/world_compare/report.md",
        "world_compare_check_text": "cmake-build-minimal-kernel-runtime-session-witness-inspect-compare-sample/candidate/witness_session_failure_export/world_compare/check.txt"
      }
    }
  },
  "comparison": {
    "summary_path": "cmake-build-minimal-kernel-runtime-session-witness-inspect-compare-sample/candidate/summary.json",
    "baseline_summary_path": "cmake-build-minimal-kernel-runtime-session-witness-inspect-compare-sample/baseline/summary.json",
    "changed": true,
    "result": {
      "current": "fail",
      "baseline": "ok",
      "changed": true
    },
    "session": {
      "status": {
        "current": "collapsed",
        "baseline": "standing",
        "changed": true
      },
      "failure_domain": {
        "current": "runtime",
        "baseline": null,
        "changed": true
      },
      "failure_count_delta": 1,
      "ledger_event_count_delta": 3,
      "runtime": {
        "regressed": [
          "task_syscall",
          "handoff_continuity"
        ],
        "improved": [],
        "changed": true
      }
    },
    "world_compare_session_drift": {
      "verdict": {
        "current": "drifted",
        "baseline": "collapsed",
        "changed": true
      },
      "changed_flag": {
        "current": true,
        "baseline": true,
        "changed": false
      },
      "failure_codes": {
        "added": [
          "tick_not_observed"
        ],
        "removed": [],
        "changed": true
      },
      "missing_runtime_facts": {
        "added": [
          "task_syscall"
        ],
        "removed": [],
        "changed": true
      },
      "affected_focus": {
        "added": [
          "timer"
        ],
        "removed": [],
        "changed": true
      }
    },
    "witness_session_failure_export": {
      "verdict": {
        "current": "collapsed",
        "baseline": "collapsed",
        "changed": false
      },
      "candidate_session_status": {
        "current": "collapsed",
        "baseline": "fail",
        "changed": true
      },
      "changed_flag": {
        "current": true,
        "baseline": true,
        "changed": false
      },
      "failure_codes": {
        "added": [
          "thread_not_resumed"
        ],
        "removed": [],
        "changed": true
      },
      "missing_runtime_facts": {
        "added": [
          "task_syscall"
        ],
        "removed": [],
        "changed": true
      },
      "affected_focus": {
        "added": [
          "scheduler"
        ],
        "removed": [],
        "changed": true
      }
    },
    "violations": {
      "added": [
        "synthetic inspect compare drift",
        "session runtime regressed"
      ],
      "removed": [],
      "changed": true
    }
  }
}
